issue_id,issue_number,title,state,created_date,closed_date,contributors,repo_owner,repo_name
I_kwDOAbI7X861ts0c,60230,Forum login message,OPEN,2025-05-08T11:09:22Z,,,freeCodeCamp,freeCodeCamp
I_kwDOAbI7X861ONli,60168,Lightbox Viewer lab tests,OPEN,2025-05-05T18:00:19Z,,,freeCodeCamp,freeCodeCamp
I_kwDOAbI7X862Fyis,60278,Progress Bookmarking for Challenges or Tutorials,OPEN,2025-05-11T12:47:09Z,,,freeCodeCamp,freeCodeCamp
I_kwDOAbI7X861ULFv,60181,update cat painting workshop to use specific assert methods step 38-39,OPEN,2025-05-06T08:24:03Z,,,freeCodeCamp,freeCodeCamp
I_kwDOAbI7X862LWGa,60289,update cat painting workshop steps 46-47 to use specific asserts,OPEN,2025-05-12T10:11:11Z,,,freeCodeCamp,freeCodeCamp
I_kwDOAbI7X862bxUo,60325,update cat painting workshops steps 50-51 to use specific asserts,OPEN,2025-05-13T17:16:53Z,,,freeCodeCamp,freeCodeCamp
I_kwDOAbI7X861sa5w,60228,Persisting Last User Activity,OPEN,2025-05-08T09:05:56Z,,,freeCodeCamp,freeCodeCamp
I_kwDOAbI7X861G4VS,60153,Test is to strict in event hub lab,OPEN,2025-05-05T03:00:01Z,,,freeCodeCamp,freeCodeCamp
I_kwDOAbI7X862bzqX,60326,update workshop cat painting steps 52-53 to use specific asserts,OPEN,2025-05-13T17:19:48Z,,,freeCodeCamp,freeCodeCamp
I_kwDOAbI7X862bpLs,60324,Build a Todo App using Local Storage wording,OPEN,2025-05-13T17:02:39Z,,,freeCodeCamp,freeCodeCamp
I_kwDOAbI7X862PbCa,60304,Auto-dismiss “Settings updated” notification after 10 seconds,OPEN,2025-05-12T16:20:29Z,,,freeCodeCamp,freeCodeCamp
I_kwDOAbI7X862a267,60321,freeze,CLOSED,2025-05-13T15:37:51Z,2025-05-13T16:37:41Z,,freeCodeCamp,freeCodeCamp
I_kwDOAbI7X860-p3l,60129,Add checks to ensure that proper headings are present in english curriculum challenges,OPEN,2025-05-02T15:45:35Z,,,freeCodeCamp,freeCodeCamp
I_kwDOAbI7X862LZdk,60290,update cat painting workshop steps 48-49 to use specific asserts,CLOSED,2025-05-12T10:14:39Z,2025-05-12T19:12:54Z,Yogesh-Bhagwani,freeCodeCamp,freeCodeCamp
I_kwDOAbI7X862M3vl,60297,fCC Forum Leaderboard - tests too restrictive for avatars img element,OPEN,2025-05-12T12:38:06Z,,,freeCodeCamp,freeCodeCamp
I_kwDOAbI7X862Crw7,60267,"Typo in the ""Build a Rock, Paper, Scissors Game."" workshop - step 12",CLOSED,2025-05-10T13:43:11Z,2025-05-12T09:59:34Z,Abdallah-scout,freeCodeCamp,freeCodeCamp
I_kwDOAbI7X862GU2j,60280,"Navigation returns to wrong course section in the ""Learn the Box Model"" section path",OPEN,2025-05-11T17:24:19Z,,,freeCodeCamp,freeCodeCamp
I_kwDOAbI7X862CtVp,60268,"Typo in the Computer Basics Quiz (""Github"" instead of ""GitHub"")",CLOSED,2025-05-10T13:53:42Z,2025-05-12T09:44:58Z,ChaseKnowlden,freeCodeCamp,freeCodeCamp
I_kwDOAbI7X8614JRh,60246,update cat painting workshop to use specific assert methods step 44-45,CLOSED,2025-05-09T08:19:52Z,2025-05-12T08:14:03Z,YUVRAJSINGH3112,freeCodeCamp,freeCodeCamp
I_kwDOAbI7X862EZ1-,60276,Typo Build a Todo App using Local Storage Step 20,CLOSED,2025-05-11T00:33:19Z,2025-05-12T08:10:23Z,sakshiinayak,freeCodeCamp,freeCodeCamp
I_kwDOAbI7X862Guty,60282,Chromium's audio restrictions mess up Build a Drum Machine lab,OPEN,2025-05-11T20:55:19Z,,,freeCodeCamp,freeCodeCamp
I_kwDOAbI7X86uLYKV,59290,Questionable behaviour when using the Tab key to navigate the lecture video sites,OPEN,2025-03-15T15:27:47Z,,,freeCodeCamp,freeCodeCamp
I_kwDOAbI7X862CBzT,60266,"""Saved! Your code was saved to your browser's local storage."" - banner has no timeout, carries over when changing page",OPEN,2025-05-10T10:02:54Z,,,freeCodeCamp,freeCodeCamp
I_kwDOAbI7X86cxsbm,57029,Issue with Exercise Accessibility on Mobile,OPEN,2024-11-02T06:57:22Z,,LucasTStephens,freeCodeCamp,freeCodeCamp
I_kwDOAbI7X860LvK9,60017,Step 59 Learn Regular Expressions by Building a Password Generator Scientific Computing with Python,CLOSED,2025-04-27T10:02:09Z,2025-05-10T22:08:56Z,Ajay-2005,freeCodeCamp,freeCodeCamp
I_kwDOAbI7X8619VF2,60257,Debugging Techniques: How Does the Debugger Statement Work?,OPEN,2025-05-09T17:19:34Z,,,freeCodeCamp,freeCodeCamp
I_kwDOAbI7X8614HTD,60245,update cat painting workshop to use specific assert methods step 42-43,CLOSED,2025-05-09T08:17:19Z,2025-05-10T09:40:50Z,loralridz,freeCodeCamp,freeCodeCamp
I_kwDOAbI7X8619f0e,60258,"Storybuilding App: Step 6 - Change wording to reference main element, not div element",OPEN,2025-05-09T17:36:24Z,,,freeCodeCamp,freeCodeCamp
I_kwDOAbI7X8613CAB,60243,Typo in English challenges,CLOSED,2025-05-09T06:33:41Z,2025-05-10T07:28:39Z,VisibleNasir,freeCodeCamp,freeCodeCamp
I_kwDOAbI7X860EgBm,60006,Update graphic in default browser styles lecture video,CLOSED,2025-04-25T21:42:40Z,2025-05-09T23:41:59Z,estefaniacn,freeCodeCamp,freeCodeCamp
I_kwDOAbI7X86139y_,60244,Typo in How to Improve the Perceived Performance of Features,CLOSED,2025-05-09T07:59:55Z,2025-05-09T18:42:00Z,meenakshi,freeCodeCamp,freeCodeCamp
I_kwDOAbI7X861qg61,60225,Missing explanation for `<source>` tag,CLOSED,2025-05-08T05:09:09Z,2025-05-09T16:29:45Z,ArakhshQ,freeCodeCamp,freeCodeCamp
I_kwDOAbI7X8615Lub,60248,"Typo in the ""How Do You Add Attributes with setAttribute()?"" lecture",CLOSED,2025-05-09T10:00:25Z,2025-05-09T16:22:39Z,vishnudt2004,freeCodeCamp,freeCodeCamp
I_kwDOAbI7X861MY3S,60160,update cat painting workshop to use specific assert methods step 34-35,CLOSED,2025-05-05T14:45:28Z,2025-05-09T06:28:38Z,tanush29,freeCodeCamp,freeCodeCamp
I_kwDOAbI7X861PTNH,60172,Cat Photo 17 passes without href,CLOSED,2025-05-05T19:58:47Z,2025-05-09T05:54:59Z,Supravisor,freeCodeCamp,freeCodeCamp
I_kwDOAbI7X861g5oD,60208,stray forumTopicId in lab,CLOSED,2025-05-07T09:15:30Z,2025-05-09T03:52:32Z,Wale Ayandiran (walecloud),freeCodeCamp,freeCodeCamp
I_kwDOAbI7X861vbc0,60231,Code evaluated twice after saving,OPEN,2025-05-08T14:02:29Z,,,freeCodeCamp,freeCodeCamp
I_kwDOAbI7X8603Drm,60106,Update import/export react lecture video to include multiple ways for imports and exports,OPEN,2025-05-01T17:30:10Z,,,freeCodeCamp,freeCodeCamp
I_kwDOAbI7X861N6ft,60166,Remove user stories and tests for pseudo classes in business card lab,CLOSED,2025-05-05T17:28:58Z,2025-05-08T15:55:37Z,Supravisor,freeCodeCamp,freeCodeCamp
I_kwDOAbI7X861gEei,60207,Update test of Cat Photo App Step 17 to trim whitespaces,CLOSED,2025-05-07T08:06:55Z,2025-05-08T10:26:43Z,Ajay-2005,freeCodeCamp,freeCodeCamp
I_kwDOAbI7X86zpW8_,59923,No indication of the tests running,CLOSED,2025-04-23T13:10:20Z,2025-05-08T09:49:09Z,a2937,freeCodeCamp,freeCodeCamp
I_kwDOAbI7X861mfDo,60216,A missing sign in the cource,CLOSED,2025-05-07T17:58:25Z,2025-05-08T08:47:31Z,,freeCodeCamp,freeCodeCamp
I_kwDOAbI7X86z5zAK,59974,update cafe menu tests to use specific asserts steps 66-78,CLOSED,2025-04-24T19:36:16Z,2025-05-08T07:50:57Z,clarencepenz,freeCodeCamp,freeCodeCamp
I_kwDOAbI7X861mhWY,60217,Remove sentence in transcript for HTML boilerplate lecture,CLOSED,2025-05-07T18:02:25Z,2025-05-07T23:17:59Z,anuplohar001,freeCodeCamp,freeCodeCamp
I_kwDOAbI7X860WC0s,60039,Update to wording that crowdin likes.,OPEN,2025-04-28T17:42:38Z,,,freeCodeCamp,freeCodeCamp
I_kwDOAbI7X861g79u,60209,update cat painting workshop to use specific assert methods step 33,CLOSED,2025-05-07T09:18:37Z,2025-05-07T20:33:13Z,Sir-En00n3,freeCodeCamp,freeCodeCamp
I_kwDOAbI7X861h4MW,60213,Typo in English challenge,CLOSED,2025-05-07T10:50:59Z,2025-05-07T19:22:37Z,anuplohar001,freeCodeCamp,freeCodeCamp
I_kwDOAbI7X86ys67W,59752,Add set 2 of questions for CSS Typography Quiz,CLOSED,2025-04-16T02:03:57Z,2025-05-07T19:11:45Z,Supravisor,freeCodeCamp,freeCodeCamp
I_kwDOAbI7X86ys4Sz,59750,Add set 2 of questions for CSS layout and effects quiz,CLOSED,2025-04-16T01:58:57Z,2025-05-07T18:59:38Z,Supravisor;jdwilkin4,freeCodeCamp,freeCodeCamp
I_kwDOAbI7X861mrXN,60219,Number constructor lecture video has incorrect code example and explanation,OPEN,2025-05-07T18:19:02Z,,,freeCodeCamp,freeCodeCamp
I_kwDOAbI7X861DFku,60142,"Add Search Suggestions for Articles, Tutorials, and Books",OPEN,2025-05-03T16:06:15Z,,,freeCodeCamp,freeCodeCamp
I_kwDOAbI7X861YClG,60189,build a calculator can be hardcoded,CLOSED,2025-05-06T14:07:47Z,2025-05-07T14:54:24Z,Averand1,freeCodeCamp,freeCodeCamp
I_kwDOAbI7X861cTFs,60200,Width for code examples in lectures are not the same,OPEN,2025-05-06T21:46:42Z,,,freeCodeCamp,freeCodeCamp
I_kwDOAbI7X861hR-i,60211,test,CLOSED,2025-05-07T09:49:03Z,2025-05-07T09:53:20Z,,freeCodeCamp,freeCodeCamp
I_kwDOAbI7X861e9Dq,60203,Clarify order of operations in add-items-to-an-array-with-push-and-unshift.md description,CLOSED,2025-05-07T06:03:26Z,2025-05-07T08:45:33Z,,freeCodeCamp,freeCodeCamp
I_kwDOAbI7X861e56d,60202,Fix typo in add-items-to-an-array-with-push-and-unshift.md description,CLOSED,2025-05-07T05:56:44Z,2025-05-07T06:02:30Z,,freeCodeCamp,freeCodeCamp
I_kwDOAbI7X861WIbz,60184,build a calculator test too restrictive,CLOSED,2025-05-06T11:14:38Z,2025-05-06T21:51:39Z,c0d1ng-ma5ter,freeCodeCamp,freeCodeCamp
I_kwDOAbI7X861cUE_,60201,Update react fundamentals and chapter review pages for import/export udpates,OPEN,2025-05-06T21:48:42Z,,,freeCodeCamp,freeCodeCamp
I_kwDOAbI7X861aItk,60195,[Full Stack] - Lab Password Generator App doesn't pass curriculum tests,OPEN,2025-05-06T17:26:15Z,,,freeCodeCamp,freeCodeCamp
I_kwDOAbI7X861agW5,60197,Football Team Cards lab tests,OPEN,2025-05-06T18:09:12Z,,,freeCodeCamp,freeCodeCamp
I_kwDOAbI7X861UOIc,60182,update cat painting workshop to use specific assert methods step 40-41,CLOSED,2025-05-06T08:29:02Z,2025-05-06T17:24:41Z,Sky-walkerX,freeCodeCamp,freeCodeCamp
I_kwDOAbI7X861Mk-K,60161,update cat painting workshop to use specific assert methods step 36-37,CLOSED,2025-05-05T15:03:21Z,2025-05-06T08:47:32Z,ArakhshQ,freeCodeCamp,freeCodeCamp
I_kwDOAbI7X861TPNc,60179,Remove validation status from feedback text,OPEN,2025-05-06T06:54:48Z,,,freeCodeCamp,freeCodeCamp
I_kwDOAbI7X861UGwZ,60180,Handle log statements in redirection.ts,OPEN,2025-05-06T08:17:32Z,,,freeCodeCamp,freeCodeCamp
I_kwDOAbI7X861OmLg,60169,No Content - Styling Forms Review,CLOSED,2025-05-05T18:43:20Z,2025-05-06T05:01:38Z,,freeCodeCamp,freeCodeCamp
I_kwDOAbI7X861QnBi,60173,Code not being recognized.,CLOSED,2025-05-05T23:01:48Z,2025-05-05T23:22:06Z,,freeCodeCamp,freeCodeCamp
I_kwDOAbI7X861E7Zc,60147,Import Fonts Error in Build an Event Flyer Page,OPEN,2025-05-04T12:06:39Z,,,freeCodeCamp,freeCodeCamp
I_kwDOAbI7X860_uq_,60131,Workshop Music Player - Step 43: Incorrect hint for null value test,CLOSED,2025-05-02T18:34:20Z,2025-05-05T07:25:44Z,bobofishbo,freeCodeCamp,freeCodeCamp
I_kwDOAbI7X8607cps,60124,update cat painting workshop to use specific assert methods step 29,CLOSED,2025-05-02T08:33:38Z,2025-05-05T06:24:18Z,LuluZhuu,freeCodeCamp,freeCodeCamp
I_kwDOAbI7X86prkTf,58725,Python output is cut off,OPEN,2025-02-11T23:19:42Z,,,freeCodeCamp,freeCodeCamp
I_kwDOAbI7X861FQTS,60148,Misleading example in instruction in 'Build a Recipe Ingredient Converter',OPEN,2025-05-04T14:50:22Z,,,freeCodeCamp,freeCodeCamp
I_kwDOAbI7X86y2DdZ,59776,"Feature Request: ""Start Where You Left Off"" for Lessons",OPEN,2025-04-16T19:09:33Z,,,freeCodeCamp,freeCodeCamp
I_kwDOAbI7X861C4j-,60140,Navbar Tab Should Return to Home Page Instead of Learn Page,CLOSED,2025-05-03T14:13:14Z,2025-05-04T11:26:25Z,,freeCodeCamp,freeCodeCamp
I_kwDOAbI7X861DNKj,60143,"""Visit the Curriculum"" link on the freeCodeCamp Forum redirects to homepage instead of curriculum page",CLOSED,2025-05-03T17:15:04Z,2025-05-04T11:24:48Z,,freeCodeCamp,freeCodeCamp
I_kwDOAbI7X8607ZwM,60123,"update cat painting workshop to use specific assert methods step 25,28,30,31,32",CLOSED,2025-05-02T08:26:36Z,2025-05-04T08:30:16Z,GuptaShubham-11,freeCodeCamp,freeCodeCamp
I_kwDOAbI7X861BAFZ,60135,[Article] - Pyscript demo source points to missing source location,CLOSED,2025-05-02T22:39:28Z,2025-05-03T22:18:57Z,,freeCodeCamp,freeCodeCamp
I_kwDOAbI7X86zbrtu,59879,do we need a new issue template for the English curriculum? and maybe for other challenge types?,OPEN,2025-04-22T08:42:54Z,,,freeCodeCamp,freeCodeCamp
I_kwDOAbI7X86rE54P,58939,freeCodeCamp logo lacks navigation to /learn homepage on login / sign up page,OPEN,2025-02-21T23:02:30Z,,,freeCodeCamp,freeCodeCamp
I_kwDOAbI7X8609_Ph,60127,Build a Music Player typo,CLOSED,2025-05-02T14:19:36Z,2025-05-02T23:07:34Z,vishnudt2004,freeCodeCamp,freeCodeCamp
I_kwDOAbI7X860_2iE,60132,Build a Music Player step 27 typo,CLOSED,2025-05-02T18:55:35Z,2025-05-02T22:40:46Z,joonhoswe,freeCodeCamp,freeCodeCamp
I_kwDOAbI7X8606bFr,60119,"""Build a lunch"" lab: failure message for getRandomLunch()",OPEN,2025-05-02T05:29:10Z,,,freeCodeCamp,freeCodeCamp
I_kwDOAbI7X86ys5rt,59751,Add set 2 of questions for CSS Flexbox quiz,OPEN,2025-04-16T02:01:28Z,,,freeCodeCamp,freeCodeCamp
I_kwDOAbI7X86ytAfG,59755,Add set 2 of questions for CSS Variables quiz,OPEN,2025-04-16T02:19:27Z,,,freeCodeCamp,freeCodeCamp
I_kwDOAbI7X86ys_JN,59754,Add set 2 of questions for Responsive Web design quiz,OPEN,2025-04-16T02:15:19Z,,,freeCodeCamp,freeCodeCamp
I_kwDOAbI7X86ytCMr,59757,Add set 2 of questions for CSS Animations quiz,OPEN,2025-04-16T02:24:38Z,,,freeCodeCamp,freeCodeCamp
I_kwDOAbI7X86dwajV,57113,Shortest-Path-Algorithm Challenge: Report with suggestions to improve the learning experience,OPEN,2024-11-10T01:58:08Z,,,freeCodeCamp,freeCodeCamp
I_kwDOAbI7X86z5tF4,59969,Build an availability table issue,OPEN,2025-04-24T19:23:50Z,,,freeCodeCamp,freeCodeCamp
I_kwDOAbI7X86yqVPT,59740,Customer Complaint Form - Should accept input event on textarea elements,OPEN,2025-04-15T19:45:35Z,,,freeCodeCamp,freeCodeCamp
I_kwDOAbI7X8600gzy,60103,update cat painting workshop to use specific assert methods step 27,CLOSED,2025-05-01T11:24:14Z,2025-05-02T08:31:39Z,joonhoswe,freeCodeCamp,freeCodeCamp
I_kwDOAbI7X8600gfB,60102,update cat painting workshop to use specific assert methods step 24,CLOSED,2025-05-01T11:23:01Z,2025-05-02T06:41:19Z,cansuakgl,freeCodeCamp,freeCodeCamp
I_kwDOAbI7X8605Hz2,60113,"Quiz After ""What Are Binary Logical Operators, and How Do They Work?"" Lecture Missing ""(&&)""",OPEN,2025-05-01T23:02:48Z,,,freeCodeCamp,freeCodeCamp
I_kwDOAbI7X8605Ohs,60115,Possibility of two valid answers in the specificity for ID selectors lecture,OPEN,2025-05-01T23:28:11Z,,,freeCodeCamp,freeCodeCamp
I_kwDOAbI7X860oi2L,60079,update cat painting workshop to use specific assert methods step 19,CLOSED,2025-04-30T08:22:52Z,2025-05-01T22:30:46Z,shaikhFaris,freeCodeCamp,freeCodeCamp
I_kwDOAbI7X860x9MF,60095,Popular trends in technology verb-ing,OPEN,2025-05-01T02:03:44Z,,,freeCodeCamp,freeCodeCamp
I_kwDOAbI7X8601m_Y,60104,Build a Customer Complaint Form test 16 and 24 same text,OPEN,2025-05-01T14:15:25Z,,,freeCodeCamp,freeCodeCamp
I_kwDOAbI7X860y_Hm,60096,Typo in Map object lecture,CLOSED,2025-05-01T06:30:26Z,2025-05-01T11:46:02Z,JainSourav30,freeCodeCamp,freeCodeCamp
I_kwDOAbI7X860x7my,60094,"Add ""🟢 In Progress"" Indicator for Partially Completed Certifications on the Learn Page",CLOSED,2025-05-01T02:00:13Z,2025-05-01T05:35:54Z,,freeCodeCamp,freeCodeCamp
I_kwDOAbI7X86ytMju,59758,Remove the bubbles next to the superblock buttons on the map,CLOSED,2025-04-16T02:53:14Z,2025-05-01T05:21:40Z,huyenltnguyen;khalil423;moT01,freeCodeCamp,freeCodeCamp
I_kwDOAbI7X860o2mb,60081,update cat painting workshop to use specific assert methods step 23,CLOSED,2025-04-30T08:55:44Z,2025-05-01T05:11:06Z,MrKleenex12,freeCodeCamp,freeCodeCamp
I_kwDOAbI7X86yss9R,59743,Add set 2 of questions for Computer Basics Quiz,CLOSED,2025-04-16T01:26:35Z,2025-05-01T01:43:37Z,Supravisor,freeCodeCamp,freeCodeCamp
I_kwDOAbI7X86ysuGQ,59744,Add set 2 of questions for Basic CSS quiz,CLOSED,2025-04-16T01:30:40Z,2025-05-01T01:43:11Z,Supravisor;jdwilkin4,freeCodeCamp,freeCodeCamp
I_kwDOAbI7X860opk7,60080,Add code examples to JS Strings review,CLOSED,2025-04-30T08:34:39Z,2025-04-30T19:16:33Z,a2937,freeCodeCamp,freeCodeCamp
I_kwDOAbI7X86r0fRy,59021,Rename Pokemon Project,OPEN,2025-02-26T19:55:15Z,,,freeCodeCamp,freeCodeCamp
I_kwDOAbI7X86r0d14,59020,Rename Mario Project,OPEN,2025-02-26T19:52:58Z,,,freeCodeCamp,freeCodeCamp
I_kwDOAbI7X860p-l5,60083,Build a City Skyline Checks are Funky,OPEN,2025-04-30T10:49:05Z,,,freeCodeCamp,freeCodeCamp
I_kwDOAbI7X86y-igJ,59792,Web performance lectures,CLOSED,2025-04-17T14:53:51Z,2025-04-30T12:56:57Z,kubowania,freeCodeCamp,freeCodeCamp
I_kwDOAbI7X860c2J3,60057,update cat painting workshop to use specific assert methods step 3,CLOSED,2025-04-29T08:13:12Z,2025-04-30T09:33:44Z,Sudhir810,freeCodeCamp,freeCodeCamp
I_kwDOAbI7X860ivHc,60074,Missing HTML boilerplate in Build a Newspaper Article lab,CLOSED,2025-04-29T17:05:46Z,2025-04-30T08:49:52Z,Jackkv,freeCodeCamp,freeCodeCamp
I_kwDOAbI7X860c3T9,60058,update cat painting workshop to use specific assert methods step 18,CLOSED,2025-04-29T08:15:18Z,2025-04-30T07:38:41Z,linaslabs,freeCodeCamp,freeCodeCamp
I_kwDOAbI7X86z17mX,59949,Fix typos in Performance lecture block,CLOSED,2025-04-24T13:14:52Z,2025-04-30T06:00:20Z,ldtr89,freeCodeCamp,freeCodeCamp
I_kwDOAbI7X86xDqtE,59582,Todo App - Step 34: Replace null check with empty string check,CLOSED,2025-04-03T19:49:41Z,2025-04-30T00:33:21Z,c0d1ng-ma5ter;jdwilkin4,freeCodeCamp,freeCodeCamp
I_kwDOAbI7X86zpQl1,59921,Downloaded code says 'undefined' at the top,CLOSED,2025-04-23T13:02:07Z,2025-04-29T20:24:59Z,a2937,freeCodeCamp,freeCodeCamp
I_kwDOAbI7X860Q425,60022,update cat painting workshop to use specific assert methods steps 1 and 5,CLOSED,2025-04-28T09:33:09Z,2025-04-29T18:28:52Z,njnr14,freeCodeCamp,freeCodeCamp
I_kwDOAbI7X860YxCy,60047,B1 English for Developers - 28th Question: Answer is visible before clicking the explanation,CLOSED,2025-04-28T22:24:06Z,2025-04-29T17:25:52Z,DanielRosa74;clarencepenz,freeCodeCamp,freeCodeCamp
I_kwDOAbI7X860doKC,60064,Misplaced explanation text in English challenges,CLOSED,2025-04-29T09:30:52Z,2025-04-29T17:17:59Z,,freeCodeCamp,freeCodeCamp
I_kwDOAbI7X86z5xc6,59970,update cafe menu tests to use specific asserts steps 14-26,CLOSED,2025-04-24T19:33:04Z,2025-04-29T16:44:45Z,clarencepenz,freeCodeCamp,freeCodeCamp
I_kwDOAbI7X86z5yYu,59972,update cafe menu tests to use specific asserts steps 40-52,CLOSED,2025-04-24T19:35:01Z,2025-04-29T16:34:17Z,clarencepenz,freeCodeCamp,freeCodeCamp
I_kwDOAbI7X86z5xvU,59971,update cafe menu tests to use specific asserts steps 27-39,CLOSED,2025-04-24T19:33:40Z,2025-04-29T16:27:25Z,clarencepenz,freeCodeCamp,freeCodeCamp
I_kwDOAbI7X860b_es,60055,Fix typo in CSS styling forms lecture,CLOSED,2025-04-29T06:42:06Z,2025-04-29T11:07:45Z,abhijeet-singhh,freeCodeCamp,freeCodeCamp
I_kwDOAbI7X86z5yqb,59973,update cafe menu tests to use specific asserts steps 53-65,CLOSED,2025-04-24T19:35:33Z,2025-04-29T11:04:16Z,clarencepenz,freeCodeCamp,freeCodeCamp
I_kwDOAbI7X860aX_o,60051,Typo found in README file,CLOSED,2025-04-29T02:28:50Z,2025-04-29T06:00:52Z,,freeCodeCamp,freeCodeCamp
I_kwDOAbI7X86z5zSB,59975,update cafe menu tests to use specific asserts steps 79-end,CLOSED,2025-04-24T19:36:47Z,2025-04-28T23:03:41Z,clarencepenz,freeCodeCamp,freeCodeCamp
I_kwDOAbI7X860V7Fd,60038,External CSS question may have two correct answers,CLOSED,2025-04-28T17:29:16Z,2025-04-28T17:51:29Z,,freeCodeCamp,freeCodeCamp
I_kwDOAbI7X860UugY,60035,BASIC CSS REVIEW is missing shorthand explanation,CLOSED,2025-04-28T15:25:30Z,2025-04-28T20:36:49Z,vishal27shetty,freeCodeCamp,freeCodeCamp
I_kwDOAbI7X860RmUk,60025,replace tag with element,CLOSED,2025-04-28T10:40:20Z,2025-04-28T19:34:55Z,vishal27shetty,freeCodeCamp,freeCodeCamp
I_kwDOAbI7X860UlYp,60034,Full Stack - Build a Markdown to HTML Converter tests 38 and 47,OPEN,2025-04-28T15:15:51Z,,,freeCodeCamp,freeCodeCamp
I_kwDOAbI7X860Q7BS,60023,update cat painting workshop to use specific methods step 4,CLOSED,2025-04-28T09:36:15Z,2025-04-28T12:15:19Z,ShauryaDusht,freeCodeCamp,freeCodeCamp
I_kwDOAbI7X860QgTE,60021,Unable to Enter Text into the Preview Field (Black Box),CLOSED,2025-04-28T08:58:31Z,2025-04-28T09:12:14Z,,freeCodeCamp,freeCodeCamp
I_kwDOAbI7X860Axlm,59998,use specific assert methods in cat painting workshop step 5,CLOSED,2025-04-25T13:40:03Z,2025-04-28T09:29:26Z,amoghmadireddi,freeCodeCamp,freeCodeCamp
I_kwDOAbI7X86ys-Lk,59753,Add set 2 of questions for CSS Positioning quiz,OPEN,2025-04-16T02:12:11Z,,,freeCodeCamp,freeCodeCamp
I_kwDOAbI7X86skN31,59129,Markdown to HTML Converter - JavaScript,OPEN,2025-03-04T19:05:22Z,,,freeCodeCamp,freeCodeCamp
I_kwDOAbI7X860BC0r,60000,use specific assert methods in cat painting workshop step 7,CLOSED,2025-04-25T14:06:58Z,2025-04-26T20:46:06Z,MelvinManni,freeCodeCamp,freeCodeCamp
I_kwDOAbI7X86z9mDx,59991,use specific assert methods in cat painting workshop step 68,CLOSED,2025-04-25T07:46:05Z,2025-04-26T19:38:16Z,Lohith-11,freeCodeCamp,freeCodeCamp
I_kwDOAbI7X86z_pMR,59996,use specific assert methods in cat painting workshop step 57,CLOSED,2025-04-25T11:36:23Z,2025-04-26T19:36:16Z,tarek-gritli,freeCodeCamp,freeCodeCamp
I_kwDOAbI7X860BE00,60001,use specific assert methods in cat painting workshop step 17,CLOSED,2025-04-25T14:09:58Z,2025-04-26T19:30:19Z,Lynsoo,freeCodeCamp,freeCodeCamp
I_kwDOAbI7X855klxW,52536,Python test runner umbrella issue,OPEN,2023-12-13T12:42:46Z,,,freeCodeCamp,freeCodeCamp
I_kwDOAbI7X86QC8Cd,55559,Allow all valid versions of browser alert,OPEN,2024-07-18T15:10:51Z,,,freeCodeCamp,freeCodeCamp
I_kwDOAbI7X86K1kyB,55060,Building a Spreadsheet: Logic for avoiding self-reference in function calls is broken,OPEN,2024-06-01T19:21:56Z,,,freeCodeCamp,freeCodeCamp
I_kwDOAbI7X86AOJ1V,53836,JavaScript Algorithms and Data Structures (Beta) - Certification Projects - Directing campers away from incorrect solution,OPEN,2024-02-23T14:21:25Z,,,freeCodeCamp,freeCodeCamp
I_kwDOAbI7X8559Y1b,52583,[python]: learn-recursion-by-solving-the-tower-of-hanoi-puzzle,OPEN,2023-12-18T09:20:11Z,,,freeCodeCamp,freeCodeCamp
I_kwDOAbI7X86LfCa6,55111,Definitions should be improved for SciComPy,OPEN,2024-06-07T10:49:35Z,,,freeCodeCamp,freeCodeCamp
I_kwDOAbI7X86zYlE_,59871,Step 42 Build a Balance Sheet Unclear instructions,OPEN,2025-04-22T00:44:08Z,,,freeCodeCamp,freeCodeCamp
I_kwDOAbI7X86yiMm8,59725,Full stack HTML Accessibility Lab: Build a checkout page - exercise not in line with good ARIA practice,OPEN,2025-04-15T06:34:38Z,,,freeCodeCamp,freeCodeCamp
I_kwDOAbI7X86zH7ZK,59810,Adding an extra option to the official Dark Theme of FCC on VS Code.,OPEN,2025-04-18T15:37:22Z,,,freeCodeCamp,freeCodeCamp
I_kwDOAbI7X86z_a8g,59995,Use specific assert methods in Cafe Menu workshop steps,CLOSED,2025-04-25T11:12:11Z,2025-04-25T11:29:51Z,,freeCodeCamp,freeCodeCamp
I_kwDOAbI7X86z4yxE,59964,HTML Review - Minor grammar error and duplicate explanation,CLOSED,2025-04-24T17:44:21Z,2025-04-25T07:33:10Z,clarencepenz,freeCodeCamp,freeCodeCamp
I_kwDOAbI7X86yQxBJ,59694,Test 6 for Build Real Time Counter Lab does not account for HTML maxlength attr,CLOSED,2025-04-12T21:55:40Z,2025-04-25T06:48:26Z,omarraf,freeCodeCamp,freeCodeCamp
I_kwDOAbI7X86z4DLv,59959,Typo in English challenge,CLOSED,2025-04-24T16:29:05Z,2025-04-24T22:17:39Z,OKmimech,freeCodeCamp,freeCodeCamp
I_kwDOAbI7X86z5MgZ,59966,Remove `console.log` from challenge test,CLOSED,2025-04-24T18:25:20Z,2025-04-24T19:48:23Z,akremdh1,freeCodeCamp,freeCodeCamp
I_kwDOAbI7X86ys10A,59748,Add set 2 of questions for CSS pseudo classes quiz,CLOSED,2025-04-16T01:52:59Z,2025-04-24T19:07:43Z,jdwilkin4;zxc-w,freeCodeCamp,freeCodeCamp
I_kwDOAbI7X86z4ITx,59960,Minor typo in computer basics review,CLOSED,2025-04-24T16:36:55Z,2025-04-24T18:24:03Z,omarraf,freeCodeCamp,freeCodeCamp
I_kwDOAbI7X86zXkX0,59868,cross-origin error - Design a Blog Post Card,CLOSED,2025-04-21T21:01:35Z,2025-04-24T14:37:10Z,ShaunSHamilton,freeCodeCamp,freeCodeCamp
I_kwDOAbI7X86zoXNW,59916,"Remove ""Try again"" from feedback text",CLOSED,2025-04-23T11:35:20Z,2025-04-24T14:28:07Z,AilaLu,freeCodeCamp,freeCodeCamp
I_kwDOAbI7X86ys2Xd,59749,Add set 2 of questions for CSS colors quiz,CLOSED,2025-04-16T01:55:13Z,2025-04-24T14:25:40Z,ErinYB;Eyb100,freeCodeCamp,freeCodeCamp
I_kwDOAbI7X86zhfvM,59897,JavaScript Trivia Bot - allow separate declarations and assignments,CLOSED,2025-04-22T19:10:18Z,2025-04-24T14:17:23Z,Priyesh1311421,freeCodeCamp,freeCodeCamp
I_kwDOAbI7X86z1hVV,59948,Updated lecture videos for the Full Stack Certification - What are some common performance measurement tools,CLOSED,2025-04-24T12:43:49Z,2025-04-24T12:55:43Z,,freeCodeCamp,freeCodeCamp
I_kwDOAbI7X86z1goV,59947,Updated lecture videos for the Full Stack Certification - What is the difference between real performance and perceived performance?,CLOSED,2025-04-24T12:42:46Z,2025-04-24T12:54:57Z,,freeCodeCamp,freeCodeCamp
I_kwDOAbI7X86zPnYI,59827,CSS Typography Review missing info and fixup,OPEN,2025-04-20T20:33:30Z,,,freeCodeCamp,freeCodeCamp
I_kwDOAbI7X86znwoP,59913,Remove stub feedback from the correct answer,CLOSED,2025-04-23T10:31:49Z,2025-04-24T09:22:58Z,Abdallah-scout,freeCodeCamp,freeCodeCamp
I_kwDOAbI7X86zvfV9,59939,Missing indentation for css examples for transcript in CSS transform property lecture,CLOSED,2025-04-24T00:49:16Z,2025-04-24T09:00:20Z,omarraf,freeCodeCamp,freeCodeCamp
I_kwDOAbI7X86yT5Us,59701,Email Update Form Accepts Invalid or Non-Existent Email Domains,CLOSED,2025-04-13T23:46:17Z,2025-04-24T04:58:19Z,,freeCodeCamp,freeCodeCamp
I_kwDOAbI7X86znzx0,59914,Incomplete feedback text in Learn How to Clarify Information in Different Interactions Task 64,CLOSED,2025-04-23T10:36:34Z,2025-04-24T01:45:44Z,clarencepenz,freeCodeCamp,freeCodeCamp
I_kwDOAbI7X86zhsKa,59899,update cafe menu tests to use specific asserts steps 1-13,CLOSED,2025-04-22T19:37:34Z,2025-04-24T01:37:12Z,JoJoJo-JoJoJo,freeCodeCamp,freeCodeCamp
I_kwDOAbI7X86zVNdX,59859,specific methods not used in hotel feedback form workshop,CLOSED,2025-04-21T15:27:21Z,2025-04-24T01:04:41Z,c0d1ng-ma5ter,freeCodeCamp,freeCodeCamp
I_kwDOAbI7X86zh4WW,59902,business card lab limiting test,CLOSED,2025-04-22T20:04:07Z,2025-04-24T00:10:25Z,clarencepenz,freeCodeCamp,freeCodeCamp
